{
  "schemaVersion": 1,
  "identity": {
    "worldId": "japan-world",
    "artifactWorldId": "JP_NATIONAL_OPEN_WORLD",
    "manifestId": "local.japan-open-world",
    "name": "Japan Open World",
    "description": "One persistent national open world expanded prefecture by prefecture.",
    "version": "0.2.0",
    "author": "Giancarlo Martinelli (gcm)",
    "compatibilityLineage": ["japan-world", "JP_NATIONAL_OPEN_WORLD", "tokyo-kanagawa-world"]
  },
  "tileViews": {
    "catalog": "geography/tile-views.json",
    "initialTileId": "JP_TOKYO_MAINLAND",
    "ownershipBoundary": "geography/prefectures.geojson",
    "boundaryOverlay": "geography/display-boundaries.json"
  },
  "map": {
    "computationBoundary": "japan/geography/prefectures-full.geojson",
    "sourceLock": "sources.lock.json",
    "sourceLayout": "map.json",
    "profile": "osm-depot-world-v1",
    "worldContextTileId": "JP_TOKYO_MAINLAND",
    "basemapRevision": "japan-source-romaji-v1",
    "labelPolicy": "japan-source-romaji-v1"
  },
  "demand": {
    "adapter": "estat-japan",
    "definition": "demand.json",
    "routingProfile": "osrm-driving-v1",
    "nativePopPrefixes": ["jp-national-local-", "jp-tk-local-"],
    "crossPopPrefixes": ["jp-national-cross-", "jp-tk-cross-"]
  },
  "runtime": {
    "storageNamespace": "open-world-sidecar-local.japan-open-world-v1",
    "tileServerPort": 8799,
    "tileServerProvider": "shared-native-v4",
    "tileBaseGlobal": "JAPAN_OPEN_WORLD_TILE_BASE",
    "diagnosticNamespace": "japan",
    "healthTile": "JP_TOKYO_MAINLAND/8/227/100.mvt?v=japan-source-romaji-v1",
    "requiredHostCapabilities": ["native-save-authority-v1", "native-ledger-authority-v1"]
  },
  "release": {
    "platformCompatibility": "^1.0.0",
    "artifactSelection": "explicit",
    "artifactLayout": "split-map-demand-v1"
  }
}
